{
  "schemaVersion": 1,
  "project": {
    "id": "sample-mini-game",
    "title": "ミニゲーム（構成サンプル）",
    "description": "ブラウザアプリの掲載を確認するための架空の作品です。実際のゲームや公開先はありません。紹介画像は検証用のプレースホルダーです。",
    "category": "games",
    "status": "in-development",
    "visibility": "public",
    "tags": ["puzzle", "browser"]
  },
  "launch": { "type": "external", "url": "https://example.com/sample-mini-game/" },
  "catalog": {
    "featured": true,
    "thumbnail": { "path": "media/sample-mini-game/thumbnail.png", "alt": "画像表示の検証用に作成した幾何学模様。実際のゲーム画面ではありません。" },
    "screenshots": [{ "path": "media/sample-mini-game/screenshot.png", "alt": "スクリーンショット表示を確認するための幾何学模様。" }]
  },
  "publication": { "visibility": "public", "launchEnabled": false }
}
