{
  "schemaVersion": 1,
  "project": {
    "id": "poseref",
    "title": "PoseRef",
    "description": "画像生成AIに渡すポーズと構図の参考画像を作るツールです。マネキンにポーズを付けてカメラを決め、3Dビューを PNG として書き出し、参考画像用のプロンプト（日本語・英語）をコピーできます。ポーズのプリセット、元に戻す・やり直す、視点キューブ、回転リングなどを備え、作業内容はブラウザ内に保存されます。Claude Code / Codex からポーズを付ける AI 連携は、npx poseref で起動するローカル版で使えます。",
    "category": "tools",
    "status": "stable",
    "visibility": "public",
    "tags": [
      "ポーズ",
      "構図",
      "画像生成AI",
      "3D"
    ]
  },
  "launch": {
    "type": "external",
    "url": "https://pirafu-poseref.pages.dev"
  },
  "catalog": {
    "featured": false,
    "thumbnail": {
      "path": "media/poseref/582585b10cba74f313224eb644accf12d4184778268ea5029126f11ec0be8e05.png",
      "alt": "PoseRefの編集画面。中央の3Dビューにポーズを付けたマネキン、右にポーズの棒人間サムネイルの一覧、上にツールバーが並ぶ"
    },
    "screenshots": []
  },
  "links": {
    "repository": "https://github.com/Termnix-IT/PoseRef"
  },
  "publication": {
    "visibility": "public",
    "launchEnabled": true
  }
}
