{
  "schemaVersion": 1,
  "project": {
    "id": "cli-registration-check",
    "title": "CLI登録検証用（非掲載）",
    "description": "pirafu registerによる登録・更新・同一内容での再実行を検証する非掲載レコードです。",
    "category": "tools",
    "status": "archived",
    "visibility": "hidden",
    "tags": []
  },
  "launch": {
    "type": "showcase"
  },
  "catalog": {
    "featured": false
  },
  "publication": {
    "visibility": "hidden",
    "launchEnabled": false
  }
}
